{
  "schema_version": "0.1.0",
  "profile_id": "synthetic-affine-preview-001",
  "table_id": "vision-table-001",
  "source_kind": "synthetic",
  "active_length_mm": 2540,
  "active_width_mm": 1270,
  "orientation_status": "provisional",
  "ball_diameter_mm": null,
  "pocket_centers_mm": [],
  "landmarks": [
    {
      "pixel_x": 0,
      "pixel_y": 0,
      "x_mm": 0,
      "y_mm": 0
    },
    {
      "pixel_x": 100,
      "pixel_y": 0,
      "x_mm": 200,
      "y_mm": 0
    },
    {
      "pixel_x": 0,
      "pixel_y": 100,
      "x_mm": 0,
      "y_mm": 300
    },
    {
      "pixel_x": 100,
      "pixel_y": 100,
      "x_mm": 200,
      "y_mm": 300
    }
  ]
}
